<?xml version='1.0' encoding='utf-8'?>
<ClinicalDocument xmlns="urn:hl7-org:v3" xmlns:xsi="http://www.w3.org/2001/XMLSchema-instance" xmlns:dt="https://www.mhlw.go.jp/stf/seisakunitsuite/bunya/0000161103.html" xsi:schemaLocation="urn:hl7-org:v3 hg08_V08.xsd https://www.mhlw.go.jp/stf/seisakunitsuite/bunya/0000161103.html coreschemas/datatypes_hcgv08.xsd">
  <typeId root="2.16.840.1.113883.1.3" extension="POCD_HD000040"/>
  <id root="1.2.392.200119.6.1.5" extension="HG_DOC_001"/>
  <code code="20" codeSystem="1.2.392.200119.6.1001" displayName="特定保健指導情報"/>
  <title>積極支援プログラム</title>
  <effectiveTime value="20231201"/>
  <confidentialityCode code="N" codeSystem="2.16.840.1.113883.5.25"/>
  <languageCode code="ja-JP"/>
  <recordTarget>
    <patientRole>
      <id root="1.2.392.200119.6.201" extension="P003"/>
      <id root="1.2.392.200119.6.203" extension="INS003"/>
      <patient>
        <name>
          <dt:family>指導</dt:family>
          <dt:given>良子</dt:given>
        </name>
        <administrativeGenderCode code="Female" codeSystem="1.2.392.200119.6.1104"/>
        <birthTime value="19780720"/>
      </patient>
    </patientRole>
  </recordTarget>
  <author>
    <assignedAuthor>
      <id root="1.2.392.200119.6.102.1" extension="AUTH_GUIDE_CTR"/>
    </assignedAuthor>
  </author>
  <custodian>
    <assignedCustodian>
      <representedCustodianOrganization>
        <id root="1.2.392.200119.6.102.1" extension="CUST_GUIDE_CTR"/>
      </representedCustodianOrganization>
    </assignedCustodian>
  </custodian>
  <documentationOf>
    <serviceEvent>
      <effectiveTime>
        <dt:low value="20231101"/>
        <dt:high value="20231130"/>
      </effectiveTime>
    </serviceEvent>
  </documentationOf>
  <component typeCode="COMP">
    <structuredBody>
      <component>
        <section>
          <code/>
        </section>
      </component>
    </structuredBody>
  </component>
</ClinicalDocument>
