<?xml version='1.0' encoding='utf-8'?>
<ClinicalDocument xmlns="urn:hl7-org:v3" xmlns:xsi="http://www.w3.org/2001/XMLSchema-instance" xmlns:dt="https://www.mhlw.go.jp/stf/seisakunitsuite/bunya/0000161103.html" xsi:schemaLocation="urn:hl7-org:v3 hg08_V08.xsd https://www.mhlw.go.jp/stf/seisakunitsuite/bunya/0000161103.html coreschemas/datatypes_hcgv08.xsd">
  <typeId root="2.16.840.1.113883.1.3" extension="POCD_HD000040"/>
  <id root="1.2.392.200119.6.1.5" extension="HG_DOC_002"/>
  <code code="20" codeSystem="1.2.392.200119.6.1001" displayName="特定保健指導情報"/>
  <title>動機づけ支援ライト</title>
  <effectiveTime value="20231205"/>
  <confidentialityCode code="N" codeSystem="2.16.840.1.113883.5.25"/>
  <languageCode code="ja-JP"/>
  <recordTarget>
    <patientRole>
      <id root="1.2.392.200119.6.201" extension="P004"/>
      <id root="1.2.392.200119.6.203" extension="INS004"/>
      <patient>
        <name>
          <dt:family>保健</dt:family>
          <dt:given>太郎</dt:given>
        </name>
        <administrativeGenderCode code="Male" codeSystem="1.2.392.200119.6.1104"/>
        <birthTime value="19650210"/>
      </patient>
    </patientRole>
  </recordTarget>
  <author>
    <assignedAuthor>
      <id root="1.2.392.200119.6.102.1" extension="AUTH_GUIDE_CTR"/>
    </assignedAuthor>
  </author>
  <custodian>
    <assignedCustodian>
      <representedCustodianOrganization>
        <id root="1.2.392.200119.6.102.1" extension="CUST_GUIDE_CTR"/>
      </representedCustodianOrganization>
    </assignedCustodian>
  </custodian>
  <documentationOf>
    <serviceEvent>
      <effectiveTime>
        <dt:low value="20231105"/>
        <dt:high value="20231204"/>
      </effectiveTime>
    </serviceEvent>
  </documentationOf>
  <component typeCode="COMP">
    <structuredBody>
      <component>
        <section>
          <code code=""/>
          <title>特定保健指導共通情報</title>
          <text>特定保健指導の共通情報を以下に示す。</text>
        </section>
      </component>
      <component>
        <section>
          <code code=""/>
          <title>初回面接情報</title>
          <entry typeCode="DRIV">
            <observation classCode="OBS" moodCode="EVN">
              <code code=""/>
              <value xsi:type="dt:INT" value="80"/>
            </observation>
          </entry>
        </section>
      </component>
    </structuredBody>
  </component>
</ClinicalDocument>
